{
  "question": "Siapa yang menjabat sebagai Ketua Gugus Tugas Pembangunan Talenta Kecerdasan Artifisial Nasional?",
  "answer": "## Informasi Ketua Gugus Tugas Pembangunan Talenta Kecerdasan Artifisial Nasional\n\nBerdasarkan Keputusan Menteri Koordinator Bidang Pembangunan Manusia dan Kebudayaan Nomor 17 Tahun 2025, Ketua Gugus Tugas Pembangunan Talenta Kecerdasan Artifisial Nasional dijabat oleh:\n\n**Dedy Permadi, SIP, MA, Ph.D.**\n\n## Susunan Keanggotaan Gugus Tugas\n\nBerikut adalah susunan keanggotaan Gugus Tugas Pembangunan Talenta Kecerdasan Artifisial Nasional:\n\n* **Pengarah**: Menteri Koordinator Bidang Pembangunan Manusia dan Kebudayaan\n* **Penasehat**:\n  1. Prof. Dr. Yohanes Surya\n  2. Prof. Dr. Hammam Riza\n  3. Prof. Dr. Richardus Eko Indrajit\n  4. Wishnutama Kusubandio\n* **Ketua**: Dedy Permadi, SIP, MA, Ph.D.\n* **Wakil Ketua**: Ir. Tony Seno Hartono, M.Ikom\n* **Anggota**:\n  1. Dr. Eng. Ayu Purwarianti, S.T., M.T.\n  2. Mulya Amri, ST, MA, Ph.D.\n  3. Risa Santoso, B.A, M.Ed.\n  4. Saskhya Aulia Prima, M.Psi.\n  5. Henke Yunkins, B.S.E.E.\n  6. Ray Frederick Djadjadinata, CFA",
  "contexts": [
    "MEMUTUSKAN: \nMenetapkan \n: KEPUTUSAN \nMENTERI \nKOORDINATOR \nBIDANG \nPEMBANGUNAN MANUSIA DAN KEBUDAYAAN TENTANG \nGUGUS TUGAS PEMBANGUNAN TALENTA KECERDASAN \nARTIFISIAL NASIONAL. \nKESATU \n: Membentuk Gugus Tugas Pembangunan Talenta Kecerdasan \nArtifisial Nasional dengan susunan keanggotaan sebagaimana  \ntercantum  dalam  Lampiran yang merupakan bagian tidak \nterpisahkan dari Keputusan ini. \nKEDUA \n: Gugus Tugas Pembangunan Talenta Kecerdasan Artifisial \nNasional sebagaimana dimaksud pada Diktum KESATU terdiri \ndari: \na. Pengarah; \nb. Penasihat; \nc. Ketua; \nd. Wakil Ketua; dan \ne. Anggota. \nKETIGA \n: Gugus Tugas Pembangunan Talenta Kecerdasan Artifisial \nNasional mempunyai tugas: \n1. memperkuat tugas dan fungsi Tim Reformasi Birokrasi \nKementerian Koordinator Bidang Pembangunan Manusia \ndan Kebudayaan khususnya di bidang transformasi digital \ndan satu data; \n2. menyusun kebijakan tema talenta kecerdasan artifisial di \nlingkungan \nKementerian \nKoordinator \nBidang",
    "MEMUTUSKAN: \nMenetapkan \n: KEPUTUSAN \nMENTERI \nKOORDINATOR \nBIDANG \nPEMBANGUNAN MANUSIA DAN KEBUDAYAAN TENTANG \nGUGUS TUGAS PEMBANGUNAN TALENTA DIGITAL DAN \nKECERDASAN ARTIFISIAL NASIONAL. \nKESATU \n: Membentuk Gugus Tugas Pembangunan Talenta Digital dan \nKecerdasan Artifisial Nasional dengan susunan keanggotaan \nsebagaimana  tercantum  dalam  Lampiran yang merupakan \nbagian tidak terpisahkan dari Keputusan ini. \nKEDUA \n: Gugus Tugas Pembangunan Talenta Digital dan Kecerdasan \nArtifisial Nasional sebagaimana dimaksud pada Diktum \nKESATU terdiri dari: \na. pengarah; \nb. penasehat; \nc. tim penguatan; dan \nd. tim pelaksana. \nKETIGA \n: Gugus Tugas Pembangunan Talenta Digital dan Kecerdasan \nArtifisial Nasional mempunyai tugas: \n1. memperkuat tugas dan fungsi Tim Reformasi Birokrasi \nKementerian Koordinator Bidang Pembangunan Manusia \ndan Kebudayaan khususnya di bidang transformasi digital \ndan satu data; \n2. menyusun kebijakan tema talenta digital, penerapan",
    "- 4 - \nLAMPIRAN \nKEPUTUSAN \nMENTERI \nKOORDINATOR \nBIDANG PEMBANGUNAN MANUSIA DAN \nKEBUDAYAAN  \nNOMOR  17  TAHUN 2025 \nTENTANG \nGUGUS TUGAS PEMBANGUNAN TALENTA \nKECERDASAN ARTIFISIAL NASIONAL \n \nGUGUS TUGAS PEMBANGUNAN TALENTA KECERDASAN ARTIFISIAL  \nNASIONAL \n \n \nA. Pengarah \n: Menteri Koordinator Bidang Pembangunan Manusia dan \nKebudayaan. \nB. Penasehat \n: 1. \nProf. Dr. Yohanes Surya; \n2. \nProf. Dr. Hammam Riza; \n3. \nProf. Dr. Richardus Eko Indrajit; dan \n4. \nWishnutama Kusubandio. \nC. Ketua \n: Dedy Permadi, SIP, MA, Ph.D. \nD. Wakil Ketua \n: Ir. Tony Seno Hartono, M.Ikom. \nE. Anggota \n: 1. \u2060Dr. Eng. Ayu Purwarianti, S.T., M.T.; \n2. \u2060Mulya Amri, ST, MA, Ph.D.;  \n3. Risa Santoso, B.A, M.Ed.; \n4. Saskhya Aulia Prima, M.Psi.; \n5. Henke Yunkins, B.S.E.E.; dan \n6. Ray Frederick Djadjadinata, CFA. \n \n \nMENTERI KOORDINATOR  \nBIDANG PEMBANGUNAN MANUSIA \nDAN KEBUDAYAAN \nREPUBLIK INDONESIA, \n \nttd. \n \nPRATIKNO\n \nSalinan sesuai dengan aslinya,",
    "KEPUTUSAN MENTERI KOORDINATOR BIDANG PEMBANGUNAN MANUSIA \nDAN KEBUDAYAAN REPUBLIK INDONESIA \nNOMOR  17  TAHUN 2025  \nTENTANG \nGUGUS TUGAS PEMBANGUNAN TALENTA KECERDASAN ARTIFISIAL \nNASIONAL \n \nMENTERI KOORDINATOR BIDANG PEMBANGUNAN MANUSIA DAN \nKEBUDAYAAN REPUBLIK INDONESIA, \n \n \nMenimbang \n: a. bahwa \nuntuk \nmendorong \ntercapainya \ntata \nkelola \npemerintahan yang baik dan berdampak pada masyarakat, \nperlu dilakukan reformasi birokrasi di bidang transformasi \ndigital dan satu data melalui pemanfaatan sains dan \nteknologi dalam bentuk kecerdasan artifisial; \nb. bahwa dalam rangka mendukung pemanfaatan sains dan \nteknologi dalam bentuk kecerdasan artifisial sebagaimana \ndimaksud pada huruf a, perlu dibentuk gugus tugas \npembangunan talenta kecerdasan artifisial nasional; \nc. bahwa berdasarkan pertimbangan sebagaimana dimaksud \npada huruf a dan huruf b, perlu menetapkan Keputusan \nMenteri Koordinator Bidang Pembangunan Manusia dan \nKebudayaan tentang Gugus Tugas Pembangunan Talenta",
    "KEPUTUSAN MENTERI KOORDINATOR BIDANG PEMBANGUNAN MANUSIA \nDAN KEBUDAYAAN REPUBLIK INDONESIA \nNOMOR  26  TAHUN 2025  \nTENTANG \nGUGUS TUGAS PEMBANGUNAN TALENTA DIGITAL DAN KECERDASAN \nARTIFISIAL NASIONAL \n \nMENTERI KOORDINATOR BIDANG PEMBANGUNAN MANUSIA DAN \nKEBUDAYAAN REPUBLIK INDONESIA, \n \n \nMenimbang \n: a. bahwa untuk mendorong reformasi birokrasi di bidang \ntransformasi digital dan satu data melalui pemanfaatan \nsains dan teknologi dalam bentuk kecerdasan artifisial, \ntelah ditetapkan Keputusan Menteri Koordinator Bidang \nPembangunan Manusia dan Kebudayaan Nomor 17 Tahun \n2025 \ntentang \nGugus \nTugas \nPembangunan \nTalenta \nKecerdasan Artifisial Nasional; \nb. bahwa tugas dan susunan keanggotaan Gugus Tugas \nPembangunan Talenta Kecerdasan Artifisial Nasional \nsudah tidak sesuai dengan kebutuhan sehingga perlu \ndiganti; \nc. bahwa berdasarkan pertimbangan sebagaimana dimaksud \npada huruf a dan huruf b, perlu menetapkan Keputusan \nMenteri Koordinator Bidang Pembangunan Manusia dan"
  ],
  "source_docs": [
    {
      "source": "[Gustu] Kepmenko 17 2025 Gugus Tugas Kecerdasan Artifisial (AI).pdf",
      "file_type": "pdf",
      "loader": "pymupdf"
    },
    {
      "source": "Kepmenko 26 2025 Gugus Tugas Kecerdasan Artifisial (AI) Baru.pdf",
      "file_type": "pdf",
      "loader": "pymupdf"
    },
    {
      "source": "[Gustu] Kepmenko 17 2025 Gugus Tugas Kecerdasan Artifisial (AI).pdf",
      "file_type": "pdf",
      "loader": "pymupdf"
    },
    {
      "source": "[Gustu] Kepmenko 17 2025 Gugus Tugas Kecerdasan Artifisial (AI).pdf",
      "file_type": "pdf",
      "loader": "pymupdf"
    },
    {
      "loader": "pymupdf",
      "source": "Kepmenko 26 2025 Gugus Tugas Kecerdasan Artifisial (AI) Baru.pdf",
      "file_type": "pdf"
    }
  ],
  "metrics": {
    "retrieval_latency": 0.2766,
    "rerank_latency": 0.3608,
    "total_processing_latency": 0.6374,
    "llm_latency": 0.9703
  },
  "system_prompt": "Jawablah dalam Bahasa Indonesia berdasarkan konteks.\nFORMAT WAJIB: Gunakan ## Header, **Poin Tebal**, dan daftar bullet. Pastikan tampilan sangat rapi dan mudah dibaca (gunakan banyak spasi/newline).",
  "mlflow_run_id": "b0b30566841646a2bd60e41085f764a1"
}