{
  "question": "apa itu gugus tugas AI ?",
  "answer": "## Gugus Tugas Pembangunan Talenta Digital dan Kecerdasan Artifisial Nasional\n\nGugus Tugas Pembangunan Talenta Digital dan Kecerdasan Artifisial Nasional adalah sebuah tim yang dibentuk untuk mendukung pembangunan talenta digital dan kecerdasan artifisial di Indonesia. Gugus tugas ini bertujuan untuk mendorong reformasi birokrasi di bidang transformasi digital dan satu data melalui pemanfaatan sains dan teknologi dalam bentuk kecerdasan artifisial.\n\n### Tujuan Gugus Tugas\n\n*   **Meningkatkan Tugas dan Fungsi Tim Reformasi Birokrasi**: memperkuat tugas dan fungsi Tim Reformasi Birokrasi Kementerian Koordinator Bidang Pembangunan Manusia dan Kebudayaan khususnya di bidang transformasi digital dan satu data.\n*   **Menyusun Kebijakan**: menyusun kebijakan tema talenta digital dan kecerdasan artifisial di lingkungan Kementerian Koordinator Bidang Pembangunan Manusia dan Kebudayaan.\n\n### Struktur Gugus Tugas\n\nGugus Tugas Pembangunan Talenta Digital dan Kecerdasan Artifisial Nasional terdiri dari:\n\n*   **Pengarah**: memberikan arahan dan bimbingan kepada gugus tugas.\n*   **Penasehat**: memberikan masukan dan evaluasi atas pelaksanaan tugas gugus tugas.\n*   **Tim Penguatan**: mengembangkan inisiatif dan program kerja pendukung transformasi digital serta integrasi data dalam mendukung reformasi birokrasi.\n*   **Tim Pelaksana**: melaksanakan tugas-tugas yang ditetapkan oleh gugus tugas.\n\n### Tugas dan Fungsi\n\nGugus Tugas Pembangunan Talenta Digital dan Kecerdasan Artifisial Nasional mempunyai tugas:\n\n1.  **Mengembangkan Inisiatif dan Program Kerja**: mengembangkan inisiatif dan program kerja pendukung transformasi digital serta integrasi data dalam mendukung reformasi birokrasi di lingkungan Kementerian Koordinator Bidang Pembangunan Manusia dan Kebudayaan.\n2.  **Mengidentifikasi Kebutuhan dan Merancang Kebijakan**: mengidentifikasi kebutuhan dan merancang kebijakan pengembangan teknologi digital dan kecerdasan artifisial yang adaptif terhadap isu pembangunan manusia dan kebudayaan.\n3.  **Mengkaji dan Menyusun Rekomendasi Kebijakan**: mengkaji dan menyusun rekomendasi kebijakan untuk memperkuat talenta digital dan kecerdasan artifisial secara nasional.",
  "contexts": [
    "- 3 - \n \nc. melakukan pengawasan terhadap pelaksanaan tugas \nGugus \nTugas \nPembangunan \nTalenta \nDigital \ndan \nKecerdasan Artifisial Nasional. \nKELIMA \n: Penasehat sebagaimana dimaksud pada Diktum KEDUA huruf \na mempunyai tugas memberikan masukan dan evaluasi atas \npelaksanaan tugas Gugus Tugas Pembangunan Talenta Digital \ndan Kecerdasan Artifisial Nasional. \nKEENAM \n: Tim penguatan sebagaimana dimaksud pada Diktum KEDUA \nhuruf c, mempunyai tugas: \n1. mengembangkan inisiatif dan program kerja pendukung \ntransformasi digital serta integrasi data dalam mendukung \nreformasi birokrasi di lingkungan Kementerian Koordinator \nBidang Pembangunan Manusia dan Kebudayaan; dan \n2. mengidentifikasi kebutuhan dan merancang kebijakan \npengembangan teknologi digital dan kecerdasan artifisial \nyang adaptif terhadap isu pembangunan manusia dan \nkebudayaan; \n3. mengkaji dan menyusun rekomendasi kebijakan untuk \nmemperkuat talenta digital dan kecerdasan artifisial secara",
    "MEMUTUSKAN: \nMenetapkan \n: KEPUTUSAN \nMENTERI \nKOORDINATOR \nBIDANG \nPEMBANGUNAN MANUSIA DAN KEBUDAYAAN TENTANG \nGUGUS TUGAS PEMBANGUNAN TALENTA KECERDASAN \nARTIFISIAL NASIONAL. \nKESATU \n: Membentuk Gugus Tugas Pembangunan Talenta Kecerdasan \nArtifisial Nasional dengan susunan keanggotaan sebagaimana  \ntercantum  dalam  Lampiran yang merupakan bagian tidak \nterpisahkan dari Keputusan ini. \nKEDUA \n: Gugus Tugas Pembangunan Talenta Kecerdasan Artifisial \nNasional sebagaimana dimaksud pada Diktum KESATU terdiri \ndari: \na. Pengarah; \nb. Penasihat; \nc. Ketua; \nd. Wakil Ketua; dan \ne. Anggota. \nKETIGA \n: Gugus Tugas Pembangunan Talenta Kecerdasan Artifisial \nNasional mempunyai tugas: \n1. memperkuat tugas dan fungsi Tim Reformasi Birokrasi \nKementerian Koordinator Bidang Pembangunan Manusia \ndan Kebudayaan khususnya di bidang transformasi digital \ndan satu data; \n2. menyusun kebijakan tema talenta kecerdasan artifisial di \nlingkungan \nKementerian \nKoordinator \nBidang",
    "MEMUTUSKAN: \nMenetapkan \n: KEPUTUSAN \nMENTERI \nKOORDINATOR \nBIDANG \nPEMBANGUNAN MANUSIA DAN KEBUDAYAAN TENTANG \nGUGUS TUGAS PEMBANGUNAN TALENTA DIGITAL DAN \nKECERDASAN ARTIFISIAL NASIONAL. \nKESATU \n: Membentuk Gugus Tugas Pembangunan Talenta Digital dan \nKecerdasan Artifisial Nasional dengan susunan keanggotaan \nsebagaimana  tercantum  dalam  Lampiran yang merupakan \nbagian tidak terpisahkan dari Keputusan ini. \nKEDUA \n: Gugus Tugas Pembangunan Talenta Digital dan Kecerdasan \nArtifisial Nasional sebagaimana dimaksud pada Diktum \nKESATU terdiri dari: \na. pengarah; \nb. penasehat; \nc. tim penguatan; dan \nd. tim pelaksana. \nKETIGA \n: Gugus Tugas Pembangunan Talenta Digital dan Kecerdasan \nArtifisial Nasional mempunyai tugas: \n1. memperkuat tugas dan fungsi Tim Reformasi Birokrasi \nKementerian Koordinator Bidang Pembangunan Manusia \ndan Kebudayaan khususnya di bidang transformasi digital \ndan satu data; \n2. menyusun kebijakan tema talenta digital, penerapan",
    "KEPUTUSAN MENTERI KOORDINATOR BIDANG PEMBANGUNAN MANUSIA \nDAN KEBUDAYAAN REPUBLIK INDONESIA \nNOMOR  26  TAHUN 2025  \nTENTANG \nGUGUS TUGAS PEMBANGUNAN TALENTA DIGITAL DAN KECERDASAN \nARTIFISIAL NASIONAL \n \nMENTERI KOORDINATOR BIDANG PEMBANGUNAN MANUSIA DAN \nKEBUDAYAAN REPUBLIK INDONESIA, \n \n \nMenimbang \n: a. bahwa untuk mendorong reformasi birokrasi di bidang \ntransformasi digital dan satu data melalui pemanfaatan \nsains dan teknologi dalam bentuk kecerdasan artifisial, \ntelah ditetapkan Keputusan Menteri Koordinator Bidang \nPembangunan Manusia dan Kebudayaan Nomor 17 Tahun \n2025 \ntentang \nGugus \nTugas \nPembangunan \nTalenta \nKecerdasan Artifisial Nasional; \nb. bahwa tugas dan susunan keanggotaan Gugus Tugas \nPembangunan Talenta Kecerdasan Artifisial Nasional \nsudah tidak sesuai dengan kebutuhan sehingga perlu \ndiganti; \nc. bahwa berdasarkan pertimbangan sebagaimana dimaksud \npada huruf a dan huruf b, perlu menetapkan Keputusan \nMenteri Koordinator Bidang Pembangunan Manusia dan",
    "KEPUTUSAN MENTERI KOORDINATOR BIDANG PEMBANGUNAN MANUSIA \nDAN KEBUDAYAAN REPUBLIK INDONESIA \nNOMOR  17  TAHUN 2025  \nTENTANG \nGUGUS TUGAS PEMBANGUNAN TALENTA KECERDASAN ARTIFISIAL \nNASIONAL \n \nMENTERI KOORDINATOR BIDANG PEMBANGUNAN MANUSIA DAN \nKEBUDAYAAN REPUBLIK INDONESIA, \n \n \nMenimbang \n: a. bahwa \nuntuk \nmendorong \ntercapainya \ntata \nkelola \npemerintahan yang baik dan berdampak pada masyarakat, \nperlu dilakukan reformasi birokrasi di bidang transformasi \ndigital dan satu data melalui pemanfaatan sains dan \nteknologi dalam bentuk kecerdasan artifisial; \nb. bahwa dalam rangka mendukung pemanfaatan sains dan \nteknologi dalam bentuk kecerdasan artifisial sebagaimana \ndimaksud pada huruf a, perlu dibentuk gugus tugas \npembangunan talenta kecerdasan artifisial nasional; \nc. bahwa berdasarkan pertimbangan sebagaimana dimaksud \npada huruf a dan huruf b, perlu menetapkan Keputusan \nMenteri Koordinator Bidang Pembangunan Manusia dan \nKebudayaan tentang Gugus Tugas Pembangunan Talenta"
  ],
  "source_docs": [
    {
      "source": "Kepmenko 26 2025 Gugus Tugas Kecerdasan Artifisial (AI) Baru.pdf",
      "file_type": "pdf",
      "loader": "pymupdf"
    },
    {
      "source": "[Gustu] Kepmenko 17 2025 Gugus Tugas Kecerdasan Artifisial (AI).pdf",
      "file_type": "pdf",
      "loader": "pymupdf"
    },
    {
      "file_type": "pdf",
      "source": "Kepmenko 26 2025 Gugus Tugas Kecerdasan Artifisial (AI) Baru.pdf",
      "loader": "pymupdf"
    },
    {
      "source": "Kepmenko 26 2025 Gugus Tugas Kecerdasan Artifisial (AI) Baru.pdf",
      "file_type": "pdf",
      "loader": "pymupdf"
    },
    {
      "source": "[Gustu] Kepmenko 17 2025 Gugus Tugas Kecerdasan Artifisial (AI).pdf",
      "file_type": "pdf",
      "loader": "pymupdf"
    }
  ],
  "metrics": {
    "retrieval_latency": 0.4275,
    "rerank_latency": 0.3415,
    "total_processing_latency": 0.769,
    "llm_latency": 1.3244
  },
  "system_prompt": "Jawablah dalam Bahasa Indonesia berdasarkan konteks.\nFORMAT WAJIB: Gunakan ## Header, **Poin Tebal**, dan daftar bullet. Pastikan tampilan sangat rapi dan mudah dibaca (gunakan banyak spasi/newline).",
  "mlflow_run_id": "fdf8b4ededad4d9186e9880d24a5969e"
}